{"schemaVersion":"1.1.0","variant":{"id":"chr9-128226027-G-A","chromosome":"chr9","position":128226027,"ref":"G","alt":"A","rsid":"rs747079285"},"provenance":{"source":"model-api","clientVersion":"0.9.0","pipelineVersion":"0.1.0","queriedAt":"2026-09-13T13:01:26Z","configHash":"898f2c0e4df684e4","calibrationEpoch":"quantiles>=2026-06-18,indels>=2026-07-14","notes":"predict_variant aparte, con ontology_terms fijado al biosample declarado."},"biosample":{"name":"glutamatergic neuron","ontologyCurie":"CL:0000679"},"finding":"Los dos donadores de rio arriba abandonan el mismo sitio aceptor y se mudan al de al lado, seis bases rio arriba. El aceptor que sostenia casi todo el empalme en REF queda practicamente en cero en ALT, y el vecino pasa de residual a dominante. No son dos efectos sueltos que coinciden: es un intercambio reciproco, y las cuatro uniones implicadas son exactamente las que tocan la posicion de la variante. Salio de ordenar las uniones de este artefacto por |ALT - REF|; no de buscar un caso ya conocido. Con el orden por magnitud estas cuatro no aparecian por ninguna parte: los arcos mas gruesos de la ventana son constitutivos y casi no se mueven entre REF y ALT.","interval":{"chromosome":"chr9","start":128221931,"end":128230123},"status":"ok","minValueShown":0.01,"totalJunctionsInWindow":2791,"junctions":[{"start":128219252,"end":128222196,"strand":"+","ref":0.0186,"alt":0.0183},{"start":128220341,"end":128222196,"strand":"+","ref":4.3426,"alt":4.329},{"start":128220341,"end":128222460,"strand":"+","ref":0.0196,"alt":0.0193},{"start":128222339,"end":128222460,"strand":"+","ref":4.2555,"alt":4.2464},{"start":128222596,"end":128222792,"strand":"+","ref":4.174,"alt":4.159},{"start":128222596,"end":128224250,"strand":"+","ref":0.0136,"alt":0.0142},{"start":128222860,"end":128224250,"strand":"+","ref":2.4783,"alt":2.5733},{"start":128222860,"end":128224270,"strand":"+","ref":0.0446,"alt":0.044},{"start":128222860,"end":128224302,"strand":"+","ref":0.014,"alt":0.0145},{"start":128222860,"end":128226028,"strand":"+","ref":0.032,"alt":1.5985},{"start":128222860,"end":128226034,"strand":"+","ref":1.427,"alt":0.0058},{"start":128222860,"end":128226069,"strand":"+","ref":0.0178,"alt":0.0042},{"start":128222860,"end":128234020,"strand":"+","ref":0.477,"alt":0.2578},{"start":128224389,"end":128226028,"strand":"+","ref":0.0269,"alt":1.454},{"start":128224389,"end":128226034,"strand":"+","ref":1.0909,"alt":0.0063},{"start":128224389,"end":128226069,"strand":"+","ref":0.0232,"alt":0.0058},{"start":128224389,"end":128234020,"strand":"+","ref":1.8722,"alt":1.41},{"start":128224389,"end":128239444,"strand":"+","ref":0.063,"alt":0.0355},{"start":128226173,"end":128226344,"strand":"+","ref":0.0086,"alt":0.0132},{"start":128226173,"end":128234020,"strand":"+","ref":0.8911,"alt":1.1703},{"start":128226173,"end":128239444,"strand":"+","ref":0.0208,"alt":0.0267}]}